01-Maven-Fuzzy-Factory/data/Outputs/bounce_rate_by_landing_page.csv

landing_page,sessions,bounced_sessions,bounce_rate_percent
/lander-1,47574,25330,53.24
/lander-4,9385,4851,51.69
/lander-3,79000,39733,50.29
/lander-2,131170,59249,45.17
/home,137576,57346,41.68
/lander-5,68166,25131,36.87

01-Maven-Fuzzy-Factory/documentation/phase_2_notes.md

### Observation

- /lander-1: 53.24% (47,574 sessions, 25,330 bounced sessions)
- /lander-4: 51.69% (9,385 sessions, 4,851 bounced sessions)
- /lander-3: 50.29% (79,000 sessions, 39,733 bounced sessions)
- /lander-2: 45.17% (131,170 sessions, 59,249 bounced sessions)
- /home: 41.68% (137,576 sessions, 57,346 bounced sessions)
- /lander-5: 36.87% (68,166 sessions, 25,131 bounced sessions)

The strongest engagement is observed on /lander-5, which has the lowest Bounce Rate at 36.87%. This is also the landing page with the highest conversion rate at 10.17%.

In contrast, /lander-3 has the lowest average pageviews per session at 2.17. This is consistent with its high Bounce Rate of 50.29% and low Conversion Rate of 3.39%.